<?xml version="1.0"?>
<!-- edited with XML Spy v4.3 U (http://www.xmlspy.com) by Daniele Colecchia (TXT e-solutions s.p.a.) -->
<!DOCTYPE report SYSTEM 'report.dtd'>
<report>
	<field name="DISTRIB_DATE" isMand="N" isMulti="N" datatype="D">
		<fieldName>DISTRIB_DATE</fieldName>
		<tableName>TP_PLANT</tableName>
	</field>
	<field name="PROD_DATE" isMand="N" isMulti="N" datatype="D">
		<fieldName>PROD_DATE</fieldName>
		<tableName>TP_PLANT</tableName>
	</field>
	<field name="LAST_ACTION_DATE" isMand="N" isMulti="N" datatype="D">
		<fieldName>LAST_ACTION_DATE</fieldName>
		<tableName>TP_PLANT</tableName>
	</field>
	<field name="ACTION_DATE" isMand="N" isMulti="N" datatype="D">
		<fieldName>ACTION_DATE</fieldName>
		<tableName>TP_HISTORY</tableName>
	</field>
	<field name="JOBNAME" isMand="N" isMulti="N" datatype="C">
		<fieldName>JOBNAME</fieldName>
		<tableName>TP_PLANT</tableName>
	</field>
	<field name="JOB_REL" isMand="N" isMulti="N" datatype="N">
		<fieldName>JOB_RELEASE</fieldName>
		<tableName>TP_PLANT</tableName>
	</field>
	<field name="JOB_REV" isMand="N" isMulti="N" datatype="N">
		<fieldName>JOB_REViSION</fieldName>
		<tableName>TP_PLANT</tableName>
	</field>
	<field name="STATUS" isMand="N" isMulti="N" datatype="C">
		<fieldName>STATUS</fieldName>
		<tableName>TP_PLANT</tableName>
	</field>
	<field name="LAST_ACTION_ACTOR" isMand="N" isMulti="N" datatype="C">
		<fieldName>LAST_ACTION_ACTOR</fieldName>
		<tableName>TP_PLANT</tableName>
	</field>
	<field name="DIVISION" isMand="N" isMulti="N" datatype="C">
		<fieldName>DIVISION</fieldName>
		<tableName>TP_PLANT</tableName>
	</field>
	<field name="VALID_LOGIN" isMand="N" isMulti="N" datatype="C">
		<fieldName>VALID_LOGIN</fieldName>
		<tableName>TP_PLANT</tableName>
	</field>
	<field name="PROD_LOGIN" isMand="N" isMulti="N" datatype="C">
		<fieldName>PROD_LOGIN</fieldName>
		<tableName>TP_PLANT</tableName>
	</field>
	<field name="LINE" isMand="N" isMulti="N" datatype="C">
		<fieldName>LINE</fieldName>
		<tableName>TP_PLANT</tableName>
	</field>
	<field name="OWNER" isMand="N" isMulti="N" datatype="C">
		<fieldName>OWNER_LOGIN</fieldName>
		<tableName>TP_PLANT</tableName>
	</field>
	<field name="OWNER_LOGIN" isMand="N" isMulti="N" datatype="C">
		<fieldName>OWNER_LOGIN</fieldName>
		<tableName>TP_PLANT</tableName>
	</field>
	<field name="VOB_STATUS" isMand="N" isMulti="N" datatype="C">
		<fieldName>VOB_STATUS</fieldName>
		<tableName>TP_PLANT</tableName>
	</field>
	<field name="FACILITY" isMand="N" isMulti="N" datatype="C">
		<fieldName>FACILITY</fieldName>
		<tableName>TP_PLANT</tableName>
	</field>
	<field name="TESTER_INFO" isMand="N" isMulti="N" datatype="C">
		<fieldName>TESTER_INFO</fieldName>
		<tableName>TP_PLANT</tableName>
	</field>
	<field name="TO_PLANT" isMand="N" isMulti="N" datatype="C">
		<fieldName>TO_PLANT</fieldName>
		<tableName>TP_PLANT</tableName>
	</field>
	<field name="FROM_PLANT" isMand="N" isMulti="N" datatype="C">
		<fieldName>FROM_PLANT</fieldName>
		<tableName>TP_PLANT</tableName>
	</field>
	<field name="PRIS_STATUS" isMand="N" isMulti="N" datatype="C">
		<fieldName>PRIS_STATUS</fieldName>
		<tableName>TP_PLANT</tableName>
	</field>
	<field name="PRIS_FOUND_DATE" isMand="N" isMulti="N" datatype="D">
		<fieldName>PRIS_FOUND_DATE</fieldName>
		<tableName>TP_PLANT</tableName>
	</field>
	<field name="PLANT" isMand="N" isMulti="N" datatype="C">
		<fieldName>INSTALLATION_ID</fieldName>
		<tableName>USERS</tableName>
	</field>
	<field name="LS_PLANT" isMand="N" isMulti="N" datatype="C">
		<fieldName>INSTALLATION_ID</fieldName>
		<tableName>LINESET</tableName>
	</field>
	<field name="LS_NAME" isMand="N" isMulti="N" datatype="C">
		<fieldName>LINESET_NAME</fieldName>
		<tableName>LINESET</tableName>
	</field>
	<field name="LS_ACTION_DATE" isMand="N" isMulti="N" datatype="D">
		<fieldName>DATE_LAST</fieldName>
		<tableName>LINESET</tableName>
	</field>
	<field name="PRODUCTION_AREA_ID" isMand="N" isMulti="N" datatype="C">
		<fieldName>PRODUCTION_AREA_ID</fieldName>
		<tableName>TP_PLANT</tableName>
	</field>
	<field name="USER" isMand="N" isMulti="N" datatype="C">
		<fieldName>TPMS_LOGIN</fieldName>
		<tableName>USERS</tableName>
		<orderList>INSTALLATION_ID, TPMS_LOGIN</orderList>
		<masterFields names="PLANT"/>
		<attr level="1" datatype="C">
			<name>firstName</name>
			<label>First name</label>
			<fieldName>FIRST_NAME</fieldName>
		</attr>
		<attr level="1" datatype="C">
			<name>surName</name>
			<label>Surname</label>
			<fieldName>SURNAME</fieldName>
		</attr>
		<attr level="1" datatype="C">
			<name>email</name>
			<label>Email</label>
			<fieldName>EMAIL</fieldName>
		</attr>
		<attr level="1" datatype="C">
			<name>plant</name>
			<label>Plant</label>
			<fieldName>INSTALLATION_ID</fieldName>
		</attr>
	</field>
	<section name="tp_report">
		<label>TP report</label>
		<tableName>TP_PLANT</tableName>
		<orderList>JOBNAME</orderList>
		<masterFields names="DIVISION DISTRIB_DATE PROD_DATE LAST_ACTION_DATE JOBNAME JOB_REL JOB_REV STATUS VALID_LOGIN PROD_LOGIN LINE FACILITY TESTER_INFO TO_PLANT PRODUCTION_AREA_ID FROM_PLANT LAST_ACTION_ACTOR OWNER VOB_STATUS PRIS_STATUS PRIS_FOUND_DATE"/>
		<attr level="1" datatype="C">
			<name>JOBNAME</name>
			<label>Job name</label>
			<fieldName>JOBNAME</fieldName>
		</attr>
		<attr level="1" datatype="C">
			<name>JOB_REL</name>
			<label>rel</label>
			<fieldName>JOB_RELEASE</fieldName>
		</attr>
		<attr level="1" datatype="C">
			<name>JOB_REV</name>
			<label>rev</label>
			<fieldName>JOB_REVISION</fieldName>
		</attr>
		<attr level="1" datatype="N">
			<name>JOB_VER</name>
			<label>ver</label>
			<fieldName>TPMS_VER</fieldName>
		</attr>
		<attr level="1" datatype="C">
			<name>FACILITY</name>
			<label>Facility</label>
			<fieldName>FACILITY</fieldName>
		</attr>
		<attr level="1" datatype="C">
			<name>TESTER_INFO</name>
			<label>Tester info</label>
			<fieldName>substr(TP_PLANT.TESTER_INFO,1,instr(TP_PLANT.TESTER_INFO,' ',1,2))</fieldName>
		</attr>
		<attr level="1" datatype="C">
			<name>LAST_ACTION_ACTOR</name>
			<label>Last Act Actor</label>
			<fieldName>LAST_ACTION_ACTOR</fieldName>
		</attr>
		<attr level="1" datatype="D" format="TIME">
			<name>DISTRIB_DATE</name>
			<label>Delivery date</label>
			<fieldName>DISTRIB_DATE</fieldName>
		</attr>
		<attr level="1" datatype="D" format="TIME">
			<name>LAST_ACTION_DATE</name>
			<label>Last action date</label>
			<fieldName>LAST_ACTION_DATE</fieldName>
		</attr>
		<attr level="1" datatype="C">
			<name>STATUS</name>
			<label>Status</label>
			<fieldName>STATUS</fieldName>
		</attr>
		<attr level="1" datatype="C">
			<name>DIVISION</name>
			<label>Division</label>
			<fieldName>DIVISION</fieldName>
		</attr>
		<attr level="1" datatype="C">
			<name>TO_PLANT</name>
			<label>Dest plant</label>
			<fieldName>TO_PLANT</fieldName>
		</attr>
		<attr level="1" datatype="C">
			<name>FROM_PLANT</name>
			<label>From plant</label>
			<fieldName>FROM_PLANT</fieldName>
		</attr>
		<attr level="2" datatype="C">
			<name>OWNER_LOGIN</name>
			<label>TP owner</label>
			<fieldName>OWNER_LOGIN</fieldName>
		</attr>
		<attr level="2" datatype="C">
			<name>VOB_STATUS</name>
			<label>Vob status</label>
			<fieldName>VOB_STATUS</fieldName>
		</attr>
		<attr level="2" datatype="C">
			<name>OWNER_EMAIL</name>
			<label>TP owner email</label>
			<fieldName>OWNER_EMAIL</fieldName>
		</attr>
		<attr level="2" datatype="C">
			<name>VALID_LOGIN</name>
			<label>Valid login</label>
			<fieldName>VALID_LOGIN</fieldName>
		</attr>
		<attr level="2" datatype="C">
			<name>PROD_LOGIN</name>
			<label>Prod login</label>
			<fieldName>PROD_LOGIN</fieldName>
		</attr>
		<attr level="1" datatype="D" format="TIME">
			<name>PROD_DATE</name>
			<label>Prod Date</label>
			<fieldName>PROD_DATE</fieldName>
		</attr>
		<attr level="2" datatype="C">
			<name>LINE</name>
			<label>Line</label>
			<fieldName>LINE</fieldName>
		</attr>
		<attr level="2" datatype="C">
			<name>PRIS_STATUS</name>
			<label>Pris status</label>
			<fieldName>PRIS_STATUS</fieldName>
		</attr>
		<attr level="2" datatype="D" format="TIME">
			<name>PRIS_FOUND_DATE</name>
			<label>Pris found date</label>
			<fieldName>PRIS_FOUND_DATE</fieldName>
		</attr>
		<attr level="2" datatype="C">
			<name>PRODUCTION_AREA_ID</name>
			<label>Production area code</label>
			<fieldName>PRODUCTION_AREA_ID</fieldName>
		</attr>
	</section>
	<section name="tp_hist_report">
		<label>TP report</label>
		<tableName>TP_PLANT</tableName>
		<orderList>JOBNAME, TO_CHAR(TP_HISTORY.ACTION_DATE,'DD/MON/YYYY HH24:MI:SS') DESC</orderList>
		<masterFields names="ACTION_DATE JOBNAME JOB_REL JOB_REV STATUS VALID_LOGIN PROD_LOGIN LINE FACILITY TESTER_INFO FROM_PLANT TO_PLANT"/>
		<attr level="1" datatype="C">
			<name>JOBNAME</name>
			<label>Job name</label>
			<fieldName>JOBNAME</fieldName>
		</attr>
		<attr level="1" datatype="C">
			<name>JOB_REL</name>
			<label>rel</label>
			<fieldName>JOB_RELEASE</fieldName>
		</attr>
		<attr level="1" datatype="C">
			<name>JOB_REV</name>
			<label>rev</label>
			<fieldName>JOB_REVISION</fieldName>
		</attr>
		<attr level="1" datatype="N">
			<name>JOB_VER</name>
			<label>ver</label>
			<fieldName>TPMS_VER</fieldName>
		</attr>
		<attr level="1" datatype="C">
			<name>FACILITY</name>
			<label>Facility</label>
			<fieldName>FACILITY</fieldName>
		</attr>
		<attr level="1" datatype="C">
			<name>TESTER_INFO</name>
			<label>Tester info</label>
			<fieldName>TESTER_INFO</fieldName>
		</attr>
		<attr level="1" datatype="C">
			<name>STATUS</name>
			<label>Status</label>
			<fieldName>STATUS</fieldName>
			<tableName>TP_HISTORY</tableName>
		</attr>
		<attr level="1" datatype="D" format="TIME">
			<name>ACTION_DATE</name>
			<label>Action date</label>
			<fieldName>ACTION_DATE</fieldName>
			<tableName>TP_HISTORY</tableName>
		</attr>
		<!--attr level="2" datatype="C">
			<name>TIMESTAMP</name>
			<fieldName>ACTION_DATE</fieldName>
			<tableName>HISTORY</tableName>
		</attr>